{
  "format": "starsector-preflight-balance-corpus-v1",
  "contentVersion": "vanilla-0.98a-seed-2026-08-28",
  "facts": [
    {
      "itemId": "anubis",
      "itemKind": "ship",
      "displayName": "Anubis",
      "provider": "vanilla",
      "gamePatch": "0.98a",
      "hullSize": "cruiser",
      "designType": "high-tech",
      "dp": 18,
      "op": 170,
      "pptSeconds": 420,
      "hullIntegrity": 7000,
      "armor": 700,
      "shieldType": "omni",
      "shieldArcDegrees": 210,
      "shieldEfficiency": 0.6,
      "shieldUpkeepPerSecond": 210,
      "fluxCapacity": 7200,
      "fluxDissipation": 420,
      "topSpeed": 80,
      "system": "Temporal Shell",
      "mounts": ["2x medium universal", "3x large energy", "1x fighter bay"],
      "builtIns": ["Design Compromises"],
      "source": {"kind": "wiki", "reference": "https://starsector.wiki.gg/wiki/Anubis", "publishedAt": null, "patch": "0.98a"}
    },
    {
      "itemId": "onslaught",
      "itemKind": "ship",
      "displayName": "Onslaught",
      "provider": "vanilla",
      "gamePatch": "0.98a",
      "hullSize": "capital",
      "designType": "low-tech",
      "dp": 40,
      "op": 360,
      "pptSeconds": 720,
      "hullIntegrity": 20000,
      "armor": 1750,
      "shieldType": "front",
      "shieldArcDegrees": 180,
      "shieldEfficiency": 1.0,
      "shieldUpkeepPerSecond": 240,
      "fluxCapacity": 17000,
      "fluxDissipation": 600,
      "topSpeed": 25,
      "system": "Burn Drive",
      "mounts": ["3x large ballistic", "4x medium missile", "6x small ballistic", "9x medium ballistic"],
      "builtIns": ["2x Thermal Pulse Cannon", "Heavy Ballistics Integration"],
      "source": {"kind": "wiki", "reference": "https://starsector.wiki.gg/wiki/Onslaught", "publishedAt": null, "patch": "0.98a"}
    },
    {
      "itemId": "onslaught_xiv",
      "itemKind": "ship",
      "displayName": "Onslaught (XIV)",
      "provider": "vanilla",
      "gamePatch": "0.98a",
      "hullSize": "capital",
      "designType": "XIV Battlegroup",
      "dp": 40,
      "op": 370,
      "pptSeconds": 720,
      "hullIntegrity": 20000,
      "armor": 1850,
      "shieldType": "front",
      "shieldArcDegrees": 180,
      "shieldEfficiency": 1.0,
      "shieldUpkeepPerSecond": 240,
      "fluxCapacity": 17850,
      "fluxDissipation": 630,
      "topSpeed": 23,
      "system": "Burn Drive",
      "mounts": ["3x large ballistic", "4x medium missile", "6x small ballistic", "9x medium ballistic"],
      "builtIns": ["2x Thermal Pulse Cannon", "Heavy Ballistics Integration", "XIV Battlegroup"],
      "source": {"kind": "wiki", "reference": "https://starsector.wiki.gg/wiki/Onslaught_(XIV)", "publishedAt": null, "patch": "0.98a"}
    },
    {
      "itemId": "paragon",
      "itemKind": "ship",
      "displayName": "Paragon",
      "provider": "vanilla",
      "gamePatch": "0.98a",
      "hullSize": "capital",
      "designType": "high-tech",
      "dp": 60,
      "op": 370,
      "pptSeconds": 720,
      "hullIntegrity": 18000,
      "armor": 1500,
      "shieldType": "omni",
      "shieldArcDegrees": 360,
      "shieldEfficiency": 0.6,
      "shieldUpkeepPerSecond": 750,
      "fluxCapacity": 25000,
      "fluxDissipation": 1250,
      "topSpeed": 30,
      "system": "Fortress Shield",
      "mounts": ["2x medium universal", "4x small missile", "4x large energy", "4x medium energy", "9x small energy"],
      "builtIns": ["Advanced Targeting Core"],
      "source": {"kind": "wiki", "reference": "https://starsector.wiki.gg/wiki/Paragon", "publishedAt": null, "patch": "0.98a"}
    },
    {
      "itemId": "executor",
      "itemKind": "ship",
      "displayName": "Executor",
      "provider": "vanilla",
      "gamePatch": "0.98a",
      "hullSize": "capital",
      "designType": "Lion's Guard",
      "dp": 50,
      "op": 350,
      "pptSeconds": 720,
      "hullIntegrity": 17000,
      "armor": 1500,
      "shieldType": "front",
      "shieldArcDegrees": 270,
      "shieldEfficiency": 0.6,
      "shieldUpkeepPerSecond": 200,
      "fluxCapacity": 14000,
      "fluxDissipation": 475,
      "topSpeed": 50,
      "system": "High Energy Focus",
      "mounts": ["2x large energy", "2x medium hybrid", "2x large missile", "4x medium ballistic", "4x small energy", "4x medium energy"],
      "builtIns": ["Solar Shielding", "Energy Bolt Coherer", "Special Modifications"],
      "source": {"kind": "wiki", "reference": "https://starsector.wiki.gg/wiki/Executor", "publishedAt": null, "patch": "0.98a"}
    },
    {
      "itemId": "pegasus",
      "itemKind": "ship",
      "displayName": "Pegasus",
      "provider": "vanilla",
      "gamePatch": "0.98a",
      "hullSize": "capital",
      "designType": "midline",
      "dp": 50,
      "op": 365,
      "pptSeconds": 720,
      "hullIntegrity": 17000,
      "armor": 1500,
      "shieldType": "front",
      "shieldArcDegrees": 270,
      "shieldEfficiency": 0.8,
      "shieldUpkeepPerSecond": 200,
      "fluxCapacity": 14000,
      "fluxDissipation": 500,
      "topSpeed": 35,
      "system": "Fast Missile Racks",
      "mounts": ["2x medium hybrid", "4x large missile", "4x medium ballistic", "4x small energy", "4x medium energy"],
      "builtIns": [],
      "source": {"kind": "wiki", "reference": "https://starsector.wiki.gg/wiki/Pegasus", "publishedAt": null, "patch": "0.98a"}
    },
    {
      "itemId": "doom",
      "itemKind": "ship",
      "displayName": "Doom",
      "provider": "vanilla",
      "gamePatch": "0.98a",
      "hullSize": "cruiser",
      "designType": "high-tech",
      "dp": 35,
      "op": 145,
      "pptSeconds": 420,
      "hullIntegrity": 8000,
      "armor": 1250,
      "shieldType": "phase cloak",
      "shieldArcDegrees": null,
      "shieldEfficiency": null,
      "shieldUpkeepPerSecond": null,
      "fluxCapacity": 10000,
      "fluxDissipation": 900,
      "topSpeed": 75,
      "system": "Mine Strike",
      "mounts": ["2x medium missile", "2x medium energy", "4x small energy", "4x small universal"],
      "builtIns": ["Phase Field", "Delicate Machinery"],
      "source": {"kind": "wiki", "reference": "https://starsector.wiki.gg/wiki/Doom", "publishedAt": null, "patch": "0.98a"}
    },
    {
      "itemId": "aurora",
      "itemKind": "ship",
      "displayName": "Aurora",
      "provider": "vanilla",
      "gamePatch": "0.98a",
      "hullSize": "cruiser",
      "designType": "high-tech",
      "dp": 30,
      "op": 165,
      "pptSeconds": 420,
      "hullIntegrity": 8000,
      "armor": 800,
      "shieldType": "omni",
      "shieldArcDegrees": 180,
      "shieldEfficiency": 0.6,
      "shieldUpkeepPerSecond": 400,
      "fluxCapacity": 11000,
      "fluxDissipation": 800,
      "topSpeed": 80,
      "system": "Plasma Jets",
      "mounts": ["2x medium synergy", "2x medium energy", "4x small synergy", "5x small energy"],
      "builtIns": [],
      "source": {"kind": "wiki", "reference": "https://starsector.wiki.gg/wiki/Aurora", "publishedAt": null, "patch": "0.98a"}
    },
    {
      "itemId": "medusa",
      "itemKind": "ship",
      "displayName": "Medusa",
      "provider": "vanilla",
      "gamePatch": "0.98a",
      "hullSize": "destroyer",
      "designType": "high-tech",
      "dp": 12,
      "op": 100,
      "pptSeconds": 300,
      "hullIntegrity": 3000,
      "armor": 300,
      "shieldType": "omni",
      "shieldArcDegrees": 120,
      "shieldEfficiency": 0.6,
      "shieldUpkeepPerSecond": 120,
      "fluxCapacity": 6000,
      "fluxDissipation": 400,
      "topSpeed": 100,
      "system": "Phase Skimmer",
      "mounts": ["2x medium energy", "2x small universal", "5x small energy"],
      "builtIns": [],
      "source": {"kind": "wiki", "reference": "https://starsector.wiki.gg/wiki/Medusa", "publishedAt": null, "patch": "0.98a"}
    },
    {
      "itemId": "afflictor",
      "itemKind": "ship",
      "displayName": "Afflictor",
      "provider": "vanilla",
      "gamePatch": "0.98a",
      "hullSize": "frigate",
      "designType": "high-tech",
      "dp": 12,
      "op": 55,
      "pptSeconds": 180,
      "hullIntegrity": 1500,
      "armor": 400,
      "shieldType": "phase cloak",
      "shieldArcDegrees": null,
      "shieldEfficiency": null,
      "shieldUpkeepPerSecond": null,
      "fluxCapacity": 3000,
      "fluxDissipation": 400,
      "topSpeed": 165,
      "system": "Entropy Amplifier",
      "mounts": ["1x small energy", "2x small hybrid", "2x small universal"],
      "builtIns": ["Phase Field", "Delicate Machinery"],
      "source": {"kind": "wiki", "reference": "https://starsector.wiki.gg/wiki/Afflictor", "publishedAt": null, "patch": "0.98a"}
    }
  ],
  "observations": [
    {
      "observationId": "grievous-098-anubis",
      "itemId": "anubis",
      "source": {"kind": "reddit", "reference": "https://www.reddit.com/r/starsector/comments/1k9569u/", "publishedAt": "2025-04-27", "patch": "0.98a"},
      "scope": "general",
      "aiTier": "A",
      "playerTier": "A",
      "reasonTags": ["AI-usability", "engagement-control", "mobility", "PD", "fighter-suppression", "flux-burden", "synergy-debt"],
      "conditions": ["general fleet use", "Paladin synergy strongly preferred", "stronger with spoiler weapons"],
      "summary": "Rated broadly useful at only 18 DP; Temporal Shell, missile/fighter suppression, and mobility carry much of the value, while the unusual flux rules and preferred loadout create real fitting constraints.",
      "contextCompleteness": "high"
    },
    {
      "observationId": "grievous-098-onslaught",
      "itemId": "onslaught",
      "source": {"kind": "reddit", "reference": "https://www.reddit.com/r/starsector/comments/1k6ydy5/", "publishedAt": "2025-04-24", "patch": "0.98a"},
      "scope": "general",
      "aiTier": "A",
      "playerTier": "S-",
      "reasonTags": ["durability", "armor-conversion", "sustained-output", "ammo-endurance", "AI-usability", "player-skill-ceiling", "fleet-scale-sensitivity"],